<?xml version="1.0" encoding="UTF-8"?>
<!--
 *  Copyright (c) 2005-2006 The Apache Software Foundation or its licensors, as applicable.
 *
 *  Licensed under the Apache License, Version 2.0 (the "License");
 *  you may not use this file except in compliance with the License.
 *  You may obtain a copy of the License at
 *
 *     http://www.apache.org/licenses/LICENSE-2.0
 *
 *  Unless required by applicable law or agreed to in writing, software
 *  distributed under the License is distributed on an "AS IS" BASIS,
 *  WITHOUT WARRANTIES OR CONDITIONS OF ANY KIND, either express or implied.
 *  See the License for the specific language governing permissions and
 *  limitations under the License.
 -->
<tns:RootElement50 xmlns:tns="http://www.apache.org/tuscany/interop"
	xmlns:xsi="http://www.w3.org/2001/XMLSchema-instance"
	xsi:schemaLocation="http://www.apache.org/tuscany/interop interop50.xsd">
	<anySimpleType>anySimpleType</anySimpleType>
	<anyType>AnyTypeString</anyType>
	<anyURI>http://tempuri.org</anyURI>
	<base64Binary>ABCD</base64Binary>
	<boolean>true</boolean>
	<boolean>false</boolean>
	<boolean>1</boolean>
	<boolean>0</boolean>
	<byte>128</byte>
	<byte>-127</byte>
	<date>2001-01-01</date>
	<dateTime>2001-12-31T12:00:00</dateTime>
	<decimal>-1.23456789</decimal>
	<decimal>1.23456789</decimal>
	<double>0.0</double>
	<double>12.3E-4</double>
	<duration>P1D</duration>
	<float>0.0</float>
	<gDay>---01</gDay>
	<gMonth>--01--</gMonth>
	<gMonthDay>--01-01</gMonthDay>
	<gYear>2001</gYear>
	<gYearMonth>2001-01</gYearMonth>
	<hexBinary>0F00</hexBinary>
	<ID>idvalue0</ID>
	<IDREF>idvalue0</IDREF>
	<IDREFS>idvalue0</IDREFS>
    <int>-2147483648</int>
	<int>2147483647</int>
	<integer>-2147483648</integer>
	<integer>2147483647</integer>
	<language>EN</language>
	<long>-9223372036854775808</long>
    <long>9223372036854775807</long>
	<Name>Name</Name>
	<NCName>NCName</NCName>
	<negativeInteger>-1</negativeInteger>
	<NMTOKEN>NMTOKEN</NMTOKEN>
	<NMTOKENS>NMTOKENS</NMTOKENS>
	<nonNegativeInteger>0</nonNegativeInteger>
	<nonPositiveInteger>0</nonPositiveInteger>
	<normalizedString>normalizedString</normalizedString>
	<NOTATION>tns:interop50</NOTATION>
	<positiveInteger>1</positiveInteger>
	<QName>QName</QName>
	<short>-32768</short>
	<short>32767</short>
	<string>string</string>
	<time>12:00:00</time>
	<token>token</token>
	<unsignedByte>0</unsignedByte>
	<unsignedByte>255</unsignedByte>
	<unsignedInt>0</unsignedInt>
	<unsignedInt>4294967295</unsignedInt>
	<unsignedLong>0</unsignedLong>
	<unsignedLong>18446744073709551615</unsignedLong>	
	<unsignedShort>0</unsignedShort>
    <unsignedShort>65535</unsignedShort>
</tns:RootElement50>
